{
  "outcome": "changes_requested",
  "summary": "Blocked by yagni: the PR adds a `writable_paths_overrides.yaml` indirection the issue never asked for. Inline the one path and delete the loader.",
  "reasoning": "yagni: BLOCK on speculative config knob (sprint_exec_yaml_v2.dip:688-694). pragmatism, testability, holistic: PASS. blocker: ATTEST with 3 walked references — but a BLOCK from any persona forces changes_requested per synthesizer rule.",
  "block_count": 1,
  "attest_valid": true,
  "feedback": [
    {
      "persona": "yagni",
      "file": "sprint/sprint_exec_yaml_v2.dip",
      "line_range": "688-694",
      "description": "writable_paths_overrides indirection is speculative; the issue asked for one anchored glob.",
      "recommendation": "Delete the overrides loader and inline the anchored glob directly on the RecoveryManager agent."
    }
  ]
}
